commit	aggregate_score	mean_score	status	description
b91c99f	0.014086	0.014097	crash	hold recovery steering fixed for the whole maneuver (captured once at trigger) instead of live-recomputing each tick: self-inflicted GDScript bug -- accidentally declared _recovery_steer twice (SCRIPT ERROR: Parse Error, see run.log), so ai_drive_task.gd failed to load entirely and every vehicle just sat with linear_velocity nil-erroring, all 3 falling off almost immediately (5.2m). Godot still printed ok:true/a JSON despite the parse error (worth noting: ok:true is not sufficient proof the script even loaded -- should sanity-check distance_m/score arent suspiciously near-zero too). Not a real result; fixing the duplicate declaration and re-testing the same idea next. 0.221560 -> 0.014086 (script parse error, reverted)
6c99a3d	0.215684	0.413616	discard	hold recovery steering fixed for the whole reverse maneuver (captured once at trigger) instead of recomputing live each tick: looked promising on a single run (aggregate 0.256338, tow_truck dist 81.2->93.9) but did NOT hold up under --repeats=3 (determinism caveat) -- worst-of-3 aggregate 0.215684, BELOW the official repeats=3-confirmed baseline 0.230213 (tow_truck worst-of-3 0.216/79.0m, trailer_truck worst-of-3 0.230/84.4m, both worse than their single-run numbers). Genuine idea (avoids the erratic tick-to-tick steering swerve during blind reverse), but net negative once non-determinism is accounted for. Reverted per PROGRAM.md step 8. 0.230213 -> 0.215684 (worst-of-3, reverted)
4edb04e	0.221560	0.440467	discard	scale target_speed CEILING (max_speed) down 0.7x for trailer-equipped vehicles only (detected via exclude.size()>1, free from the already-computed collect_body_rids call): bit-identical to baseline on ALL 3 vehicles -- diagnostic overrides test (--overrides={"trailer_speed_scale":0.05}) confirms the has_trailer detection genuinely works (extreme scale DOES change trailer_truck trajectory, dist 111.7->93.8), but at 0.7 the max_speed ceiling (25->17.5) is never actually the binding constraint anywhere on this twisty track -- other brakes (whisker_confirmation, slope) already keep cruise speed well under 17.5 the whole way, so loosening/tightening the rarely-reached ceiling has zero effect. The trailer-detection MECHANISM is validated and worth keeping as a direction; needs to scale the min_speed FLOOR used in the cornering-brake lerp instead of the max_speed ceiling. 0.221560 -> 0.221560 (unchanged, reverted -- redesigning to target min_speed next)
786fc0a	0.215646	0.659226	discard	scale min_speed FLOOR down 0.5x for ANY trailer-equipped vehicle (exclude.size()>1, matches both trailer_truck=2 bodies and tow_truck=7 bodies): huge win for trailer_truck (0.305/111.7m fell_off -> 0.967/354.4m time_up, nearly finishing the whole track!) confirming the trailer-aware-caution mechanism genuinely targets the right failure. But tow_truck (which also matches exclude.size()>1) got marginally WORSE (0.222/81.2m time_up -> 0.216/79.0m fell_off) -- trace shows tow_truck wedges at the exact same spot either way, a persistent physical chain-lock distinct from trailer_truck swinging off the bridge edge, so applying the SAME scale to it does not help and slightly hurts. Since aggregate=min(vehicles) and tow_truck is the constraint, aggregate is flat-to-slightly-down (0.221560->0.215646) despite the huge mean gain (0.440->0.659). Reverted; narrowing the gate to exclude.size()==2 (trailer_truck only, not tow_truck) next so tow_truck reverts to its original unaffected behavior while trailer_truck keeps the win. 0.221560 -> 0.215646 (single run, reverted)
1c3bcc7	0.223966	0.431306	discard	narrow the trailer min_speed scale (0.5x) gate to exclude.size()==2 exactly (trailer_truck only, not tow_truck): confirmed tow_truck is now bit-identical to baseline across all 3 repeats (0.275/0.355/0.358, matching f612ae0 exactly) as intended. But trailer_truck itself got HIGH VARIANCE, not a reliable win: repeats were 0.968(time_up)/0.224(time_up)/0.224(time_up) -- the single-run 0.967 near-finish (see 786fc0a) was real but not typical; 2 of 3 repeats still bottleneck around 82m, and that worst-of-3 (0.224) is slightly BELOW trailer_truck own prior worst-of-3 (0.230213, which was actually already the aggregate-determining vehicle at f612ae0, not tow_truck as previously assumed). Net: worst-of-3 aggregate 0.223966, a small regression from the official 0.230213 baseline. Reverted per PROGRAM.md step 8 (does not beat the previous best under repeats=3). The mechanism is directionally very promising (a 0.5x floor scale visits BOTH a near-finish and a same-as-before failure depending on run luck) -- trying a milder scale next to reduce variance while keeping some of the benefit. 0.230213 -> 0.223966 (worst-of-3, reverted)
e1cc363	0.228820	0.432924	discard	milder trailer min_speed scale (0.6 vs the 0.5 tried in 1c3bcc7), same exclude.size()==2 gate, tested directly with --repeats=3: tow_truck/car_base still bit-identical to baseline as designed. trailer_truck worst-of-3 = 0.229 (repeats 0.418(fell_off)/0.229(time_up)/0.229(time_up)) -- still high variance, still just under the 0.230213 baseline. Milder scale did not fix the variance; the worst-case trajectory seems to hit roughly the same wall regardless of exactly how much the floor is lowered in this range. Reverted. 0.230213 -> 0.228820 (worst-of-3, reverted)
afa09d0	0.227966	0.432639	discard	even lower trailer min_speed scale (0.4), same exclude.size()==2 gate, tested directly with --repeats=3: tow_truck/car_base bit-identical to baseline. trailer_truck worst-of-3 = 0.228 (repeats 0.314(fell_off)/0.313(fell_off)/0.228(time_up)) -- now falls off in 2 of 3 reps instead of just timing out, and still doesnt beat the 0.230213 baseline. Across 3 scale values tried (0.5/0.6/0.4, results.tsv 1c3bcc7/e1cc363/afa09d0) the worst-of-3 aggregate stays in a narrow 0.224-0.229 band regardless of exactly how much the cornering-brake floor is lowered -- the mechanism clearly CAN produce a near-finish in a lucky run (0.968 at scale=0.5) but the unlucky-run floor is basically insensitive to this parameter in this range, suggesting the worst-case failure mode isnt primarily a speed problem. Pausing this specific lever; the trailer-detection signal itself (exclude.size()) remains a promising building block for a future attempt that targets something other than raw speed (e.g. steering aggressiveness or a wider effective safety margin) specifically for trailer_truck. 0.230213 -> 0.227966 (worst-of-3, reverted)
e657f71	0.275003	0.714636	keep	low-pass filter (smoothing=0.3) steering command for rigid-trailer vehicle only (exclude.size()==2, free signal from OnboardSensing.collect_body_rids car_base=1/trailer_truck=2/tow_truck=7 already computed each tick): jerky per-tick steering recompute was whipping the towed Trailer body wide on the HugeTire tunnel/hairpin, causing a Y-fall (screenshot-diagnosed, runs/diag_trailer_capture/). trailer_truck now WINS all 3 repeats (1.084/1.079/1.074) instead of falling off every repeat around 84-112m. car_base/tow_truck bit-identical to baseline (gate is exact ==2, not tow_truck s 7). First real repeats=3-confirmed aggregate improvement since 0.230213 -- long-standing tunnel/hairpin bottleneck for trailer_truck substantially fixed (tow_truck is now the sole remaining bottleneck). 0.230213 -> 0.275003 (worst-of-3, kept)
ee879c5	0.226608	0.698504	discard	widen steering-smoothing gate from exclude.size()==2 to >1, extending the trailer_truck fix (e657f71, kept) to tow_truck too: trailer_truck stays perfect (1.084/1.079/1.074, unchanged since ==2 is a subset of >1). But tow_truck got WORSE, not better -- worst-of-3 dropped from its established 0.275 to 0.227 (repeats 0.234/0.227/0.227). Confirms tow_truck s failure is a different mechanism from trailer_truck s (a persistent physical chain-lock/wedge with 5 loose chain links, not primarily steering-whip on the hairpin) -- slowing its steering REACTION made it slightly worse at navigating/escaping, not better. Reverting to the ==2-only gate (back to the kept e657f71 state). 0.275003 -> 0.226608 (worst-of-3, reverted)
2f5adf8	0.216690	0.216690	discard	hold recovery steering fixed for the whole maneuver (retry of the globally-discarded 6c99a3d, now on top of the kept trailer steering-smoothing fix e657f71, targeting tow_truck specifically since trailer_truck variance no longer confounds the read): screened tow_truck alone with --repeats=3 directly (car_base/trailer_truck skipped -- this vehicle-only repeats result already conclusively fails to beat the established baseline, no need for the full 3-vehicle run). tow_truck worst-of-3 = 0.217 (repeats 0.217/0.349/0.741), WORSE than the established 0.275 baseline. Confirms tow_truck s wedge genuinely is not a steering-direction-whip problem (unlike trailer_truck s) -- fixed recovery steering does not help it either. Reverted. 0.275003 -> 0.216690 (worst-of-3 on tow_truck alone, reverted)
49d16a9	0.217369	0.217369	discard	combine boosted low-speed reverse torque (up to -100, matching the players own reverse boost) WITH fixed recovery steering direction -- an untested combination of two individually-discarded ideas (8aef100: boost alone ejected it sideways via erratic live steering; 2f5adf8/6c99a3d: fixed steering alone did not help). Hypothesis was that 8aef100 s failure was specifically the erratic direction, not the power, so fixing direction while keeping the power might work where neither did alone. Screened tow_truck alone with --repeats=3: worst-of-3 = 0.217 (repeats 0.217/0.242/0.741), still WORSE than 0.275. Trace shows the combo DOES break the frozen wedge (real velocity returns) but the car then drifts toward the tunnel edge and Y-falls via a different path -- same outcome, different route. tow_truck s wedge resists every recovery-mechanism variant tried so far (4 total: min_speed scale, steer smoothing, fixed steer alone, boost+fixed steer combo); likely needs a genuinely different signal (e.g. explicit edge-proximity caution) rather than another recovery tweak. Reverted. 0.275003 -> 0.217369 (worst-of-3 on tow_truck alone, reverted)
e08c8f0	0.215765	0.215765	discard	extra edge_safety_margin bonus (+1.5, so 3.0->4.5 out of edge_probe_max_range=6.0) for the loose-chain vehicle only (exclude.size()>2, tow_truck), braking earlier/harder near ANY edge reading as PREVENTION instead of another recovery-mechanism tweak: still worse, worst-of-3 = 0.216 (repeats 0.216/0.375/0.231), below the 0.275 baseline. tow_truck s freeze/wedge point (established via trace across multiple experiments: consistently around x -33..-42, z -101..-105, right at the HugeTire tunnel) happens WHILE the car is already slow (whisker_confirmation_brake_threshold already active there) with high engine_force and near-zero velocity -- looks like a genuine physical collision/geometric lock (likely with the tire s own collision mesh or the chain tangling on it), not primarily an edge-distance problem the edge probes could see coming. 5 distinct mechanisms now tried and failed for tow_truck (min_speed scale, steer smoothing, fixed recovery steer, boost+fixed-steer combo, edge safety margin) -- pausing further parameter-tweak attempts; a screenshot capture of tow_truck s exact wedge moment is the next diagnostic step, same technique that led to the trailer_truck breakthrough (e657f71). Reverted. 0.275003 -> 0.215765 (worst-of-3 on tow_truck alone, reverted)
965ad5f	0.374372	0.664539	keep	yaw-rate safety net (threshold 0.5 rad/s, empirically swept 0.5-3.0 -- Tier A s own 1.2 rad/s threshold does not transfer to this tier) braking toward min_speed*0.5 when angular_velocity.y magnitude is high, i.e. the car is spinning not just cornering: screenshot diagnosis (runs/diag_tow_capture/012_t24s.png) showed tow_truck rotated ~90 degrees sideways and wedged across the narrow bridge before the HugeTire tunnel -- a genuine spin-out, distinct from the forward wedge every prior tow_truck fix targeted (5 discarded attempts: 786fc0a, ee879c5, 2f5adf8, 49d16a9, e08c8f0). tow_truck worst-of-3 0.275 -> 0.779 (285-360m instead of 79-101m). trailer_truck worst-of-3 also rises to 0.840 (stacks on e657f71 s steering-smoothing fix). car_base regresses 0.795 -> 0.374 (worst-of-3, bit-identical across all 3 repeats) since this mechanism is global, not vehicle-gated -- becomes the new aggregate-determining vehicle. Net still a large win: aggregate_score FIRST EXCEEDS Tier A s reference (0.370715) in this tier s history. Follow-up: gate yaw-rate braking to trailer-equipped vehicles only, to try to also recover car_base s regression. 0.275003 -> 0.374372 (worst-of-3, kept)
b5dfcd4	0.779241	0.804731	keep	gate the yaw-rate safety net (965ad5f) to trailer-equipped vehicles only (has_any_trailer = exclude.size()>1) instead of applying it globally: car_base (no trailer) fully recovers, worst-of-3 back to 0.795 bit-identical to the original pre-965ad5f baseline across all 3 repeats -- whatever car_base does at high yaw rate evidently was not a genuine spin-out, so excluding it from this net removes the false-trigger entirely. tow_truck and trailer_truck keep their full 965ad5f gains unchanged (worst-of-3 0.779 and 0.840, both still have a trailer and pass the gate). aggregate_score now driven by tow_truck at 0.779, more than DOUBLE Tier A s reference (0.370715). 0.374372 -> 0.779241 (worst-of-3, kept)
d8e69e6	0.367046	0.367046	discard	loosen the yaw-rate brake response (yaw_brake_speed_scale 0.5->0.7) on the theory that tow_truck s worst repeat under the kept fix (b5dfcd4) now ends time_up at 285m/366m -- a pacing shortfall, not a hard failure -- so there might be room to trade a little safety margin for speed. Screened tow_truck alone with --repeats=3: worst-of-3 DROPS to 0.367 (repeats 1.016(won)/0.367(time_up)/0.984(time_up)) -- looser braking reintroduces a real instability in one of the three repeats. 0.5 is a tightly-calibrated value, not an arbitrary choice with slack in it. Reverted (including the yaw_brake_speed_scale export itself, per the simplicity criterion -- no point keeping a knob whose only tested non-default value made things worse). 0.779241 -> 0.367046 (worst-of-3 on tow_truck alone, reverted)
